cat_title,title,url
Капуста белокочанная свежая,"капуста фэг маринованная кисло-сладкая, россия, 1000 г",https://lenta.com/product/kapusta-feg-marinovannaya-kislosladkaya-rossiya-1000g-222477/
Морковь,"морковь резаная белая дача, 250г, россия, 250 г",https://lenta.com/product/morkov-belaya-dacha-rezanaya-rossiya-250g-031203/
Морковь,"морковь мытая п/э, 1000 г",https://lenta.com/product/morkov-mytaya-pe-1000g-013021/
Морковь,"морковь мытая, весовая",https://lenta.com/product/morkov-mytaya-ves-1kg-041424/
Морковь,морковь новый урожай вес,https://lenta.com/product/morkov-novyjj-urozhajj-ves--sezon-blok-1kg-422463/
Морковь,"морковь эконом, весовая",https://lenta.com/product/morkov-ekonom-ves-1kg-303639/
Морковь,"морковь отварная вес, россия",https://lenta.com/product/morkov-otvarnaya-ves-rossiya-478092/
Огурцы свежие,"огурцы лента среднеплодные гладкие, россия, 600 г",https://lenta.com/product/ogurcy-lenta-sredneplodnye-gladkie-600g-411017/
Огурцы свежие,"огурцы эстафета/атлет, весовые",https://lenta.com/product/ogurcy-estafeta-ves-sezon-blok-1kg-172569/
Огурцы свежие,"огурцы лента короткоплодные колючие, россия, 450 г",https://lenta.com/product/ogurcy-lenta-korotkoplodnye-kolyuchie-rossiya-450g-520053/
Огурцы свежие,"огурцы фэг малосольные вес, россия",https://lenta.com/product/ogurcy-feg-malosolnye-ves-rossiya-1kg-221585/
Огурцы свежие,"огурцы среднеплодные гладкие, весовые",https://lenta.com/product/ogurcy-sredneplodnye-gladkie-ves-1kg-162743/
Огурцы свежие,"огурцы короткоплодные колючие, 450 г",https://lenta.com/product/ogurcy-korotkoplodnye-kolyuchie-450g-216368/
Лук репчатый,лук репчатый новый урожай вес,https://lenta.com/product/luk-repchatyjj-novyjj-urozhajj-ves-sezon-blok-1kg-011185/
Лук репчатый,"лук репчатый, 500 г",https://lenta.com/product/luk-repchatyjj-ds-500g-525344/
Лук репчатый,лук репчатый фас вес,https://lenta.com/product/luk-repchatyjj-fas-ves-1kg-111185/
Лук репчатый,"лук красный, весовой",https://lenta.com/product/luk-krasnyjj-ves-1kg-052603/
Лук репчатый,"лук шалот, 200 г",https://lenta.com/product/luk-shalot-200g-078061/
Лук репчатый,лук репчатый вал вес,https://lenta.com/product/luk-repchatyjj-otbornyjj-fas-1kg-255487/
Яблоки,"яблоки гренни смит, 4 шт",https://lenta.com/product/yabloki-grenni-smit-4sht-411013/
Яблоки,"яблоки айдаред, весовые",https://lenta.com/product/yabloki-ajjdared-ves-1kg-043027/
Яблоки,"яблоки лента сушеные кольца, 100г, россия, 100 г",https://lenta.com/product/yabloki-lenta-sushenye-kolca-rossiya-100g-515175/
Яблоки,"яблоки ред чиф, весовые",https://lenta.com/product/yabloki-red-chif-ves-1kg-372890/
Яблоки,яблоки эконом вес,https://lenta.com/product/yabloki-ekonom-ves-1kg-301668/
Яблоки,"яблоки гольден, весовые",https://lenta.com/product/yabloki-golden-ves-1kg-068115/
Печенье,"печенье petra искушение, россия, 60 г",https://lenta.com/product/pechene-petra-iskushenie-rossiya-60g-464048/
Печенье,"печенье take a bitey безглютеновое брокколи, россия, 125 г",https://lenta.com/product/pechene-take-a-bitey-bezglyutenovoe-brokkoli-rossiya-125g-487643/
Печенье,"печенье лента бисквитное с желейной начинкой апельсин, польша, 135 г",https://lenta.com/product/pechene-lenta-biskvitnoe-s-zhelejjnojj-nachinkojj-apelsin-polsha-135g-388825/
Печенье,"печенье сормово сормовское сливочное, 200г, россия, 200 г",https://lenta.com/product/pechene-sormovo-slivochnoe-rossiya-200g-111920/
Печенье,"печенье old denmark с молочным и темным шоколадом сдобное, дания, 150 г",https://lenta.com/product/pechene-old-denmark-s-molochnym-i-temnym-shokoladom-sdobnoe-daniya-150g-427707/
Печенье,"печенье конфитрейд грибочки напугай-ка, россия, 42 г",https://lenta.com/product/pechene-konfitrejjd-gribochki-napugajjka-rossiya-42g-519803/
Карамель,"карамель рот фронт фрукты-ягодки микс, весовая, россия",https://lenta.com/product/karamel-rotfront-fruktyyagodki-miks-ves-rossiya-342695/
Карамель,"карамель chupa chups фруктовая с соком, 12г, россия, 12 г",https://lenta.com/product/karamel-chupa-chups-fruktovaya-rossiya-12g-322661/
Карамель,"карамель рот фронт гусиные лапки, весовая, россия",https://lenta.com/product/karamel-rotfront-gusinye-lapki-ves-rossiya-221502/
Карамель,"карамель каприз мини ассорти (вишня,чёрная смородина,апельсин,ананас,мята),вес, россия",https://lenta.com/product/karamel-kapriz-mini-assorti-vishnyachjrnaya-smorodinaapelsinananasmyataves-rossiya-541332/
Карамель,"карамель рот фронт цитрусовая фантазия микс, 250г, россия, 250 г",https://lenta.com/product/karamel-rotfront-citrusovaya-fantaziya-miks-rossiya-250g-347907/
Карамель,"карамель chupa chups xxl 4d со вкусом колы, вишни и дыни с жевательной резинкой внутри, 29г, россия, 29 г",https://lenta.com/product/karamel-chupa-chups-xxl-4d-so-vkusom-koly-vishni-i-dyni-s-zhevat-rezinkojj-vnutri-rossiya-29g-312287/
Чай черный байховый,"чай черный azercay букет листовой м/у, россия, 200 г",https://lenta.com/product/chajj-chernyjj-azercay-buket-listovojj-mu-rossiya-200g-500876/
Чай черный байховый,"чай черный tess pleasure с добавками, 100пак, россия, 100 пак",https://lenta.com/product/chajj-chernyjj-tess-pleasure-s-dobav-kup-rossiya-100pak-238220/
Чай черный байховый,"чай черный richard royal english breakfast байховый, 100х2г, россия, 100 пак",https://lenta.com/product/chajj-chernyjj-richard-royal-english-breakfast-chernyjj-rossiya-100pak-455811/
Чай черный байховый,"чай черный lipton елочный шар рассыпной фестив лист ж/б, россия, 20 г",https://lenta.com/product/chajj-chernyjj-lipton-elochnyjj-shar-rassypnojj-festiv-list-zhb-rossiya-20g-522839/
Чай черный байховый,"чай черный ets black tea chai к\уп, шри-ланка, 20 пак",https://lenta.com/product/chajj-chernyjj-ets-black-tea-chai-kup-shrilanka-20pak-495265/
Чай черный байховый,"чай черный twinings эрл грей с ароматом бергамота листовой, ж/б, 100г, польша, 100 г",https://lenta.com/product/chajj-chernyjj-twinings-erl-grejj-s-arom-bergamota-list-zhb-polsha-100g-014135/
Соль поваренная пищевая,"соль морская mareman поваренная садочная помол №1, 1кг, россия, 1000 г",https://lenta.com/product/sol-mareman-morskaya-povarennaya-sadochnaya-pomol-1-rossiya-1000g-262598/
Соль поваренная пищевая,"соль морская лента поваренная пищевая садочная, помол №1, высший сорт, 1кг, россия, 1000 г",https://lenta.com/product/sol-morskaya-lenta-povarennaya-pishchevaya-sadochnaya-vs-pomol-1-rossiya-1000g-369878/
Соль поваренная пищевая,"соль морская лента поваренная пищевая садочная, экстра помол №0, высший сорт, 500г, 500 г",https://lenta.com/product/sol-morskaya-lenta-ekstra-povarennaya-pishchevaya-sadochnaya-vs-pomol-0-500g-302998/
Соль поваренная пищевая,"соль морская лента поваренная пищевая садочная, помол №0, высший сорт, 150г, 150 г",https://lenta.com/product/sol-morskaya-lenta-povarennaya-pishchevaya-sadochnaya-vs-pomol-0-150g-302996/
Перец черный (горошек),"перец острый равит, 100 г",https://lenta.com/product/perec-ostryjj-ravit-100g-168864/
Перец черный (горошек),"перец черный cykoria s.a. для жарки мяса, 20г, польша, 20 г",https://lenta.com/product/perec-cykoria-sa-chernyjj-dzharki-myasa-polsha-20g-211651/
Перец черный (горошек),"перец черный bonvida горошек, 170г, россия, 170 г",https://lenta.com/product/perec-bonvida-chernyjj-goroshek-vetnam-170g-496343/
Перец черный (горошек),"перец kotanyi 4 перца, австрия, 20 г",https://lenta.com/product/priprava-kotanyi-4-perca-avstriya-20g-268186/
Перец черный (горошек),"перец kotanyi душистый горошек, австрия, 15 г",https://lenta.com/product/priprava-kotanyi-dushistyjj-goroshek-avstriya-15g-152204/
Перец черный (горошек),"перец santa maria organic с лимонным ароматом, 17г, швеция, 17 г",https://lenta.com/product/priprava-santa-maria-s-limonnym-aromatom-organik-shveciya-17g-272615/
